{
  "schema_version": "countershape/v1",
  "kind": "CandidateExecutionBinding",
  "artifact_digest": "sha256:abababababababababababababababababababababababababababababababab",
  "candidate_execution_key": "candidate:bbbbbbbbbbbbbbbbbbbbbbbbbbbbbbbbbbbbbbbbbbbbbbbbbbbbbbbbbbbbbbbb",
  "tree_identity_digest": "sha256:aaaaaaaaaaaaaaaaaaaaaaaaaaaaaaaaaaaaaaaaaaaaaaaaaaaaaaaaaaaaaaaa",
  "materialization_policy_digest": "sha256:3333333333333333333333333333333333333333333333333333333333333333",
  "world_plan_digest": "sha256:1111111111111111111111111111111111111111111111111111111111111111",
  "adapter_digest": "sha256:adadadadadadadadadadadadadadadadadadadadadadadadadadadadadadadad",
  "runner_digest": "sha256:5555555555555555555555555555555555555555555555555555555555555555",
  "projection_definition_digest": "sha256:8888888888888888888888888888888888888888888888888888888888888888"
}
